{"schema_version":"1.0","title":"JEPA Atlas","review_date":"2026-09-26","scope":"Technical briefs for the 19 papers added in the September review, not the complete awesome-JEPA catalog.","evidence_policy":"18 records have selected method/result sections checked; one is abstract-only. These are author-reported results, not independent replications. Schematic equations use normalized notation. Curator experiments are proposals, not paper claims. Publication acceptance is not inferred.","papers":[
{"id":"2605.00933","name":"CGM-JEPA","title":"CGM-JEPA: Learning Consistent Continuous Glucose Monitor Representations via Predictive Self-Supervised Pretraining","aliases":["X-CGM-JEPA"],"group":"Biosignals","concepts":["latent","temporal","grounding"],"review":"sections_checked","source":{"url":"https://arxiv.org/html/2605.00933v1","version":"v1","checked":"2026-09-26","locators":["Method; Tables 1–2"]},"problem":"Learn useful glucose representations with scarce metabolic labels.","intuition":"Hide part of a glucose trace and predict its representation. A second view describes the distribution of glucose values, rather than their order.","mechanism":"CGM-JEPA predicts masked temporal embeddings; X-CGM-JEPA adds Glucodensity cross-view prediction. Evaluation freezes the encoder and fits a logistic classifier.","objective":"context glucose → predicted masked latent ≈ target latent; X-CGM adds cross-view alignment (schematic).","training":"Unlabeled CGM pretraining; labels used for downstream probes, not pretraining.","deployment":"CGM encoder plus fitted classifier; not an insulin policy.","results":[{"task":"Home CGM: beta-cell dysfunction","metric":"AUROC","value":0.946,"unit":"0–1","baseline":"PCA","baseline_value":0.925,"protocol":"Subject-level 2-fold CV repeated 20 times; small cohorts (N=27/17 in the study).","locator":"Table 1","uncertainty":"Reported ±0.063 versus ±0.069; repeats share subjects.","direction":"higher","note":""},{"task":"Home CGM: insulin resistance","metric":"AUROC","value":0.857,"unit":"0–1","baseline":"GluFormer","baseline_value":0.889,"protocol":"Same paper, endpoint-specific comparison.","locator":"Table 2","uncertainty":"Reported ±0.112 versus ±0.103.","direction":"higher","note":""}],"limitations":["Small-cohort phenotyping; no dosing or closed-loop safety experiment.","X-CGM does not win every metric or endpoint."],"experiment":"For a new CGM study, split by subject before windowing; compare temporal-only versus temporal-plus-distribution embeddings with identical probes.","audit":""},
{"id":"2605.30865","name":"GlucoFM","title":"GlucoFM: A Dual-Stream Foundation Model for Continuous Glucose Monitoring","aliases":[],"group":"Biosignals","concepts":["latent","temporal"],"review":"sections_checked","source":{"url":"https://arxiv.org/html/2605.30865v1","version":"v1","checked":"2026-09-26","locators":["Section 3; Eq. 5; Tables 2–3"]},"problem":"Keep slow glucose state and short-lived events in the same representation.","intuition":"A daily baseline and a brief excursion tell different stories. Two streams try to retain both instead of averaging away the excursion.","mechanism":"Dual-stream latent modeling combines masked contextual reconstruction and temporal-dynamics constraints. The online encoder is retained; the EMA target branch is discarded.","objective":"L = L_masked-context + L_temporal-dynamics (Eq. 5; both weights 1).","training":"477 subjects, 109,066 hours; compact 3-layer Transformers; 0.72M trainable parameters.","deployment":"Frozen 24-hour-window embeddings with a supervised downstream probe.","results":[{"task":"14 cohort–endpoint evaluations","metric":"Average ROC-AUC","value":66.7,"unit":"percent","baseline":"CGM-JEPA, retrained on same corpus","baseline_value":62.4,"protocol":"10 repetitions of 5-fold subject-grouped CV; four downstream cohorts.","locator":"Table 3","uncertainty":null,"direction":"higher","note":"MantisV2 scores 64.7; heterogeneous pretraining is a separate comparison."}],"limitations":["Not best on every endpoint; device/sampling shifts remain.","Metabolic classification does not establish safe insulin control."],"experiment":"Probe slow-state and event streams separately. Test whether meal/exercise-related information survives compression, without labeling an observational association causal.","audit":""},
{"id":"2510.00739","name":"TD-JEPA","title":"TD-JEPA: Latent-predictive Representations for Zero-Shot Reinforcement Learning","aliases":[],"group":"Control & planning","concepts":["latent","action","decision"],"review":"sections_checked","source":{"url":"https://arxiv.org/html/2510.00739v1","version":"v1","checked":"2026-09-26","locators":["Eq. 9; Algorithm 1; Table 1"]},"problem":"Learn task-adaptable control representations before rewards are specified.","intuition":"Instead of predicting only the next state, summarize what a policy will encounter over many future steps. Later, task weights select useful behavior.","mechanism":"Temporal-difference learning builds policy-conditioned multi-step latent predictions from reward-free offline transitions; the practical method uses symmetric objectives and orthonormality regularization.","objective":"T(φ(s),a,z) ≈ stopgrad[ψ(s′) + γ T(φ(s′),a′,z)], a′ ~ π_z (normalized Eq. 9).","training":"Offline state/action/next-state transitions; target networks and task-conditioned policies.","deployment":"Infer a task representation and use its policy without task-specific policy retraining.","results":[{"task":"DMC_RGB task average","metric":"Return","value":628.8,"unit":"reward units","baseline":"BYOL-γ*","baseline_value":582.4,"protocol":"Paper-matched visual-control evaluation; not a success rate.","locator":"Table 1","uncertainty":"Reported standard errors: 5.5 versus 9.8.","direction":"higher","note":""}],"limitations":["Idealized theoretical assumptions and learned feature/task coverage matter.","Not an arbitrary-reward or safety guarantee."],"experiment":"Hold the offline dataset fixed; test unseen reward functions and identify which lie outside the representation’s task span.","audit":"This arXiv ID is the zero-shot-RL TD-JEPA. The similarly named baseline in D-JEPA is a different work; no identity or citation edge is inferred."},
{"id":"2608.24044","name":"XP-JEPA","title":"XP-JEPA: Cross-Predictive Physics Grounding for Forecastable Latent Dynamics","aliases":["JEPA-x","Cross-Predictive JEPA"],"group":"Control & planning","concepts":["latent","grounding","action","rollout"],"review":"sections_checked","source":{"url":"https://arxiv.org/html/2608.24044v1","version":"v1","checked":"2026-09-26","locators":["Section 3; Eq. 1; Section 4; Appendix C"]},"problem":"An easy-to-predict latent space may still miss physical distinctions needed for control.","intuition":"Two scenes can look alike but react differently to the same action. Training-time physical trajectories provide a second account of what really changes.","mechanism":"Separate visual/physical encoders share an action-conditioned predictor. Each branch predicts both future modalities; per-branch regularization discourages collapse.","objective":"L ≈ Σ_{m,n∈{vision,state}} ||g(z_t^m,a_t) − z_{t+1}^n||² + β(Ω_vision + Ω_state) (Eq. 1, abbreviated).","training":"Paired visual observations, actions and privileged physical trajectories.","deployment":"Discard the physical branch; visual-only latent planning.","results":[{"task":"Six evaluation subfamilies","metric":"Mean control success","value":78.2,"unit":"percent","baseline":"Visual-only model","baseline_value":53.6,"protocol":"Matched data/planner; three seeds.","locator":"Section 4; Figures 4–5","uncertainty":null,"direction":"higher","note":""},{"task":"Frozen-encoder fresh-predictor test","metric":"Rollout drift","value":0.104,"unit":"paper-defined drift","baseline":"Visual-only encoder","baseline_value":0.361,"protocol":"Original predictor removed and an identical fresh predictor fitted.","locator":"Section 4; Appendix C","uncertainty":null,"direction":"lower","note":""}],"limitations":["Physical-state decodability alone does not imply forecastability.","Visual robotics results are not physiological-control validation."],"experiment":"Compare privileged-state regression against cross-prediction; then freeze both encoders and refit the same predictor to separate representation gains from co-adaptation.","audit":"Earlier curation called this JEPA-x. The inspected v1 article uses XP-JEPA; the arXiv ID is unchanged."},